{
  "schemaVersion": "1.0",
  "domain": {
    "id": "water-utilities",
    "displayName": "Water Utilities Operations",
    "description": "Synthetic UK water customer, asset, leakage incident, repair, inspection, service interruption, and performance analytics.",
    "culture": "en-GB",
    "currency": "GBP"
  },
  "artifacts": {
    "folder": "water_utilities_hackathon",
    "lakehouse": "WaterUtilitiesDemo",
    "optimizedModel": "WaterUtilitiesSemanticModel",
    "ontology": "WaterUtilitiesOntology",
    "dataAgent": "WaterUtilitiesOperationsAgent"
  },
  "tables": [
    {
      "sourcePath": "sample-data/water-utilities/base/customers.csv", "lakehouseName": "base_customers", "modelName": "Customers",
      "description": "One row per fictional water service account holder; customer and account holder are synonyms.", "includeInModels": true,
      "columns": [
        {"source": "customer_id", "name": "Customer ID", "type": "string", "description": "Stable synthetic customer key.", "hidden": true},
        {"source": "account_holder_name", "name": "Account Holder Name", "type": "string", "description": "Fictional account label, never a real identity."},
        {"source": "customer_type", "name": "Customer Type", "type": "string", "description": "Household or Business."},
        {"source": "region", "name": "Customer Region", "type": "string", "description": "Broad synthetic UK reporting region."},
        {"source": "postcode_area", "name": "Postcode Area", "type": "string", "description": "Broad fictional postcode area only."},
        {"source": "service_status", "name": "Service Status", "type": "string", "description": "Current synthetic service relationship status."},
        {"source": "joined_date", "name": "Joined Date", "type": "date", "description": "Synthetic service start date.", "formatString": "dd/MM/yyyy"}
      ]
    },
    {
      "sourcePath": "sample-data/water-utilities/base/assets.csv", "lakehouseName": "base_assets", "modelName": "Assets",
      "description": "One row per fictional maintainable water asset with broad region and no precise location.", "includeInModels": true,
      "columns": [
        {"source": "asset_id", "name": "Asset ID", "type": "string", "description": "Stable synthetic asset key."},
        {"source": "asset_type", "name": "Asset Type", "type": "string", "description": "Synthetic infrastructure category."},
        {"source": "region", "name": "Asset Region", "type": "string", "description": "Broad synthetic UK reporting region."},
        {"source": "commissioned_date", "name": "Commissioned Date", "type": "date", "description": "Synthetic commissioning date.", "formatString": "dd/MM/yyyy"},
        {"source": "asset_status", "name": "Asset Status", "type": "string", "description": "Active or Inactive."},
        {"source": "criticality", "name": "Criticality", "type": "string", "description": "Demonstration analytical classification, not an operational risk rating."}
      ]
    },
    {
      "sourcePath": "sample-data/water-utilities/base/incidents.csv", "lakehouseName": "base_incidents", "modelName": "Incidents",
      "description": "One row per fictional leakage or service incident affecting one primary asset and optionally one customer.", "includeInModels": true,
      "columns": [
        {"source": "incident_id", "name": "Incident ID", "type": "string", "description": "Stable synthetic incident key."},
        {"source": "asset_id", "name": "Asset ID", "type": "string", "description": "Primary affected asset key.", "hidden": true},
        {"source": "customer_id", "name": "Customer ID", "type": "string", "description": "Optionally affected customer key.", "hidden": true},
        {"source": "incident_type", "name": "Incident Type", "type": "string", "description": "Leakage or service event category."},
        {"source": "severity", "name": "Severity", "type": "string", "description": "Critical, High, Medium, or Low; high severity means Critical or High."},
        {"source": "status", "name": "Incident Status", "type": "string", "description": "Open, Investigating, Resolved, or Closed."},
        {"source": "opened_at", "name": "Opened At", "type": "dateTime", "description": "Synthetic incident opening timestamp."},
        {"source": "resolved_at", "name": "Resolved At", "type": "dateTime", "description": "Synthetic resolution timestamp when resolved."},
        {"source": "estimated_leakage_m3", "name": "Estimated Leakage Volume", "type": "double", "description": "Estimated synthetic leakage volume in cubic metres.", "formatString": "#,##0.00"},
        {"source": "service_interruption_hours", "name": "Service Interruption Hours", "type": "double", "description": "Synthetic interruption duration in hours.", "formatString": "#,##0.00"},
        {"source": "repeat_incident_flag", "name": "Repeat Incident Flag", "type": "boolean", "description": "True when the asset had an earlier incident in the prior 30 days."}
      ]
    },
    {
      "sourcePath": "sample-data/water-utilities/base/work_orders.csv", "lakehouseName": "base_work_orders", "modelName": "Work Orders",
      "description": "One row per fictional repair work order belonging to one incident.", "includeInModels": true,
      "columns": [
        {"source": "work_order_id", "name": "Work Order ID", "type": "string", "description": "Stable synthetic work order key."},
        {"source": "incident_id", "name": "Incident ID", "type": "string", "description": "Owning incident key.", "hidden": true},
        {"source": "work_type", "name": "Work Type", "type": "string", "description": "Synthetic repair activity category."},
        {"source": "priority", "name": "Priority", "type": "string", "description": "Demonstration scheduling priority, not field direction."},
        {"source": "status", "name": "Work Order Status", "type": "string", "description": "Planned, In Progress, or Completed."},
        {"source": "raised_at", "name": "Raised At", "type": "dateTime", "description": "Synthetic work order creation timestamp."},
        {"source": "work_started_at", "name": "Work Started At", "type": "dateTime", "description": "Synthetic work start timestamp."},
        {"source": "promised_completion_at", "name": "Promised Completion At", "type": "dateTime", "description": "Synthetic promised completion timestamp."},
        {"source": "work_completed_at", "name": "Work Completed At", "type": "dateTime", "description": "Synthetic completion timestamp for completed work."},
        {"source": "crew_region", "name": "Crew Region", "type": "string", "description": "Broad reporting region without team identities or locations."}
      ]
    },
    {
      "sourcePath": "sample-data/water-utilities/base/inspections.csv", "lakehouseName": "base_inspections", "modelName": "Inspections",
      "description": "One row per fictional inspection of one water asset.", "includeInModels": true,
      "columns": [
        {"source": "inspection_id", "name": "Inspection ID", "type": "string", "description": "Stable synthetic inspection key."},
        {"source": "asset_id", "name": "Asset ID", "type": "string", "description": "Inspected asset key.", "hidden": true},
        {"source": "inspection_type", "name": "Inspection Type", "type": "string", "description": "Synthetic inspection category."},
        {"source": "inspected_at", "name": "Inspected At", "type": "dateTime", "description": "Synthetic inspection timestamp."},
        {"source": "result", "name": "Inspection Result", "type": "string", "description": "Passed, Advisory, or Failed."},
        {"source": "condition_score", "name": "Condition Score", "type": "int64", "description": "Synthetic one-to-five condition score."},
        {"source": "follow_up_required", "name": "Follow-up Required", "type": "boolean", "description": "Demonstration follow-up flag, not field direction."}
      ]
    },
    {
      "sourcePath": "sample-data/water-utilities/derived-routing/customer_service_impact.csv", "lakehouseName": "routing_customer_service_impact", "modelName": "Customer Service Impact", "description": "Customer-level incident and interruption classification for routing demonstrations.", "includeInModels": false,
      "columns": [
        {"source": "customer_id", "name": "Customer ID", "type": "string"}, {"source": "account_holder_name", "name": "Account Holder Name", "type": "string"}, {"source": "region", "name": "Region", "type": "string"}, {"source": "total_incidents", "name": "Total Incidents", "type": "int64"}, {"source": "active_incidents", "name": "Active Incidents", "type": "int64"}, {"source": "service_interruption_hours", "name": "Service Interruption Hours", "type": "double"}, {"source": "service_impact_segment", "name": "Service Impact Segment", "type": "string"}
      ]
    },
    {
      "sourcePath": "sample-data/water-utilities/derived-routing/asset_attention_scorecard.csv", "lakehouseName": "routing_asset_attention_scorecard", "modelName": "Asset Attention Scorecard", "description": "Asset-level latest-inspection and active-incident classification for routing demonstrations.", "includeInModels": false,
      "columns": [
        {"source": "asset_id", "name": "Asset ID", "type": "string"}, {"source": "asset_type", "name": "Asset Type", "type": "string"}, {"source": "region", "name": "Region", "type": "string"}, {"source": "asset_status", "name": "Asset Status", "type": "string"}, {"source": "active_high_severity_incidents", "name": "Active High Severity Incidents", "type": "int64"}, {"source": "latest_inspection_at", "name": "Latest Inspection At", "type": "dateTime"}, {"source": "latest_inspection_result", "name": "Latest Inspection Result", "type": "string"}, {"source": "requires_attention", "name": "Requires Attention", "type": "boolean"}, {"source": "attention_band", "name": "Attention Band", "type": "string"}
      ]
    },
    {